"FILE_NAME","FILE_LABEL","FIELD_NAME","FIELD_FORMAT","FIELD_DESC","FIELD_CODE"
"SUBJINFO.csv","[Derived] Subject Information","MITTFL","numeric","Modified Intent-to-Treat Flag","randomized subjects who have a baseline observation and at least one post-baseline observation = 1, others = 0"
"SUBJINFO.csv","[Derived] Subject Information","SUBJSAFTR","numeric","Safety Population Flag","subjects with at least 1 complete or partial infusion of study medication in OLE = 1, others = 0"
"SUBJINFO.csv","[Derived] Subject Information","PCCPFL","numeric","Placebo-Controlled Completers Population Flag",NA
"SUBJINFO.csv","[Derived] Subject Information","PRTVIIE","numeric","Protocol Violation - Eligibility Criteria Flag","had no violations of inclusion/exclusion criteria = 1, others = 0"
"SUBJINFO.csv","[Derived] Subject Information","PRTVIMAS","numeric","Protocol Violation - Missed ADCS-PACC Flag","had an assessment of the PACC at each scheduled visit they completed = 1, others = 0"
"SUBJINFO.csv","[Derived] Subject Information","CON3FL","numeric","Protocol Violation - Missed Consecutive Infusions","did not miss 3 or more consecutive infusions for reasons other than medical = 1, others = 0"
"SUBJINFO.csv","[Derived] Subject Information","PRTVITMS","numeric","Protocol Violation - Missed Infusions","did not miss any more than 10 infusions during the placebo-controlled period = 1, others = 0"
"SUBJINFO.csv","[Derived] Subject Information","PPTRTDUR","numeric","Treatment Duration >240wk for Completers Flag","for placebo-controlled period completers, the treatment duration for the study (that is, Visit 6 through Visit 66) was not more than 240 weeks + 10 days = 1, others = 0"
"SUBJINFO.csv","[Derived] Subject Information","SUBJPPSTR","numeric","Subj Per Protocol Set - TR Phase",NA
"SUBJINFO.csv","[Derived] Subject Information","LEARNFL","numeric","LEARN Participant Flag",NA
"SUBJINFO.csv","[Derived] Subject Information","TAUPETFL","numeric","Tau PET (Flortaucipir) Participant Flag",NA
"SUBJINFO.csv","[Derived] Subject Information","RESCREENFL","numeric","Rescreened Participant Flag","subjects later rescreened = 1, others = 0"
"SUBJINFO.csv","[Derived] Subject Information","PREVBID","text","Previous BID if previously screened",NA
"SV.csv","[Derived] Subject Visits","SUBSTUDY","text",NA,NA
"SV.csv","[Derived] Subject Visits","BID","text",NA,NA
"SV.csv","[Derived] Subject Visits","VISITCD","text","Visit Code",NA
"SV.csv","[Derived] Subject Visits","VISIT","text","Visit",NA
"SV.csv","[Derived] Subject Visits","SVSTDTC_DAYS_CONSENT","date","Start date/time for a Visit (Derived to days since study consent date)",NA
"SV.csv","[Derived] Subject Visits","SVSTDTC_DAYS_T0","date","Start date/time for a Visit (Derived to days since study start date [A4: Ranomization date | LEARN: Baseline registry exam date])",NA
"SV.csv","[Derived] Subject Visits","SVTYPE","text","Visit Type: What type of visit was conducted? Standard, Nonstandard, Not Done",NA
"SV.csv","[Derived] Subject Visits","SVUSEDTC_DAYS_CONSENT","date","End date/time for a Visit (Derived to days since study consent date)",NA
"SV.csv","[Derived] Subject Visits","SVUSEDTC_DAYS_T0","date","End date/time for a Visit (Derived to days since study start date [A4: Ranomization date | LEARN: Baseline registry exam date])",NA
